{
  "$schema": "https://json-schema.org/draft/2020-12/schema",
  "title": "Mangrove field site",
  "type": "object",
  "required": ["siteId", "name", "latitude", "longitude", "type", "description", "route", "birdWatchingShelters"],
  "properties": {
    "siteId": {"type": "string", "pattern": "^[a-z0-9-]+$"},
    "name": {"type": "string"},
    "latitude": {"type": ["number", "null"], "minimum": -90, "maximum": 90},
    "longitude": {"type": ["number", "null"], "minimum": -180, "maximum": 180},
    "type": {"enum": ["trail", "viewpoint", "bird-hide"]},
    "description": {"type": "string"},
    "route": {
      "type": "array",
      "items": {
        "type": "object",
        "required": ["latitude", "longitude"],
        "properties": {
          "latitude": {"type": "number", "minimum": -90, "maximum": 90},
          "longitude": {"type": "number", "minimum": -180, "maximum": 180}
        }
      }
    },
    "birdWatchingShelters": {
      "type": "array",
      "items": {
        "type": "object",
        "required": ["name", "latitude", "longitude"],
        "properties": {
          "name": {"type": "string"},
          "latitude": {"type": "number", "minimum": -90, "maximum": 90},
          "longitude": {"type": "number", "minimum": -180, "maximum": 180}
        }
      }
    }
  }
}
